Elementary Principal (2204),"To provide leadership, supervisory and administrative skills to promote educational development of each student.",Master's Degree or higher in Administration or Educational Leadership.,,"Demonstrates skills in office and financial management, and achieves balance between the role of manager and instructional leader.
Demonstrates understanding of instructional best practices, alignment to curriculum and intervention contexts differentiating the learning styles of students, PreK-5 including Special Education programs.
Demonstrates that quality of instruction is the highest educational priority, and demonstrates knowledge of effective teaching techniques.
Demonstrates knowledge of curriculum trends and awareness of curriculum needs
Monitors, assists, and supports curriculum implementation.
Supervises the maintenance of accurate records including state mandated reports and reports to parents on the educational progress and attendance of students.
Seeks and recommends the best-qualified candidates for staff positions, and provides orientation and support for new staff.
Uses a systematic program of visitation, evaluation, and conferencing to provide clear and consistent direction for all staff.
Assists students in developing responsibility for their conduct, and promotes students' respect for the rights, properties, and opinions of others.
Cooperatively monitors the safety and administration of the school and responds to emergency situations requiring first aid, etc.
Leads in the development, supervision, and evaluation of instructional and staff development programs within his/her school.
Acquaints self personally with, and maintains engaged relationships and communications with students, staff and parent community.
Acts as a liaison between the school and the community, encouraging community participation in school activities.
Develops and utilizes procedures used in reporting to the community and maintains effective communication with all stakeholders.
Interprets and enforces District policies and administrative regulations positively and with conviction.","Valid State of Michigan teaching certificate, preferably in Elementary Education.","$107,830 - $122,021 (Based on RAA Master Agreement) The successful candidate will be eligible for a comprehensive benefit package including Health, Dental, Vision and Life Insurance, paid holidays, vacation and sick days, as well as any other applicable benefits per the Rochester Administrators Association Master Agreement."
High School English Teacher,"Language Arts Licensure Area (0100) Grades 9-12 Secondary English Teacher NATURE OF WORK Under general supervision, plans, organizes and presents instruction and instructional environments which help students learn subject matter and skills that will contribute to their educational and social development. DUTIES AND RESPONSIBILITIES Provides learning experiences and teaches the course of study prescribed by the District approved curriculum. Develops and uses instructional materials suitable for verbal and/or visual instruction of students with a wide range of mental, physical and emotional maturity. Provides individual and group instruction designed to meet individual needs and motivate students. Establishes and maintains standards of student control required to achieve effective participation in all activities. Evaluates academic and social growth of students and keeps appropriate records. Provides appropriate instruction and activities for students to meet school/district policies, goals, and objectives. Communicates with parents through a variety of means. Holds parent conferences to discuss the individual student's progress and interprets the school program. Identifies student needs and cooperates with other professional staff members in assessing and helping students solve health, attitude and learning problems. Creates an effective environment for learning through functional and attractive displays such as bulletin boards, interest centers, etc. Maintains professional competence through in-service education activities provided by the district and/or professional growth activities and university courses. Participates cooperatively with the appropriate administrator to develop the method by which s/he will be evaluated in conformance with district guidelines. Selects and requisitions instructional materials; maintains inventory records. Cooperates in school-wide supervision of students during out-of-classroom activities. Participates in faculty and/or district committees and the sponsorship of student activities. Performs other related work as required. MINIMUM TRAINING AND EXPERIENCE Bachelor's degree including all courses to meet credential requirements. Valid North Carolina license in the grade levels and areas assigned. Must be No Child Left Behind qualified. ESSENTIAL JOB FUNCTIONS Must be able to use a variety of equipment and classroom tools such as computers, copiers, calculators, pencils, scissors, equipment for children, etc. Must be able to exert a negligible amount of force frequently or constantly to lift, carry, push, pull or otherwise move objects. Requires the ability to compare and/or judge the readily observable, functional, structural, or composite characteristics of data, people or things. Requires the ability to speak and/or signal people to convey or exchange information. Includes receiving instructions, assignments and/or directions from superiors. Requires the ability to ready a variety of correspondence, reports, handbooks, forms, lists, etc. Requires the ability to prepare correspondence, simple reports, forms, instructional materials, etc. using prescribed format. Requires the ability to apply principles of logical or scientific thinking to define problems, collect data, establish facts, and draw valid conclusions; to interpret an extensive variety of technical instructions in mathematical or diagrammatic form; and to deal with several abstract and concrete variables. Requires the ability to record and deliver information, to explain procedures, to follow oral and written instructions. Must be able to communicate effectively and efficiently in a variety of technical or professional languages including medical, legal and counseling terminology. Requires the ability to deal with people beyond giving and receiving instructions. Must be adaptable to performing under stress and when confronted with emergency situations. KNOWLEDGE, SKILLS AND ABILITIES Ability to manage instructional time. Ability to manage student behavior. Ability to consult with parents, teachers and the community to enhance the learning of students. Ability to monitor student performance. Ability to interact within the educational environment. Ability to perform non-instructional duties as assigned. DISCLAIMER The preceding job description has been designed to indicate the general nature and level of work performed by employees within this classification. It is not designed to contain or be interpreted as a comprehensive inventory of all duties, responsibilities, and qualifications required of employees to this job.",Bachelor's degree including all courses to meet credential requirements. Valid North Carolina license in the grade levels and areas assigned. Must be No Child Left Behind qualified.,,"Provides learning experiences and teaches the course of study prescribed by the District approved curriculum.
Develops and uses instructional materials suitable for verbal and/or visual instruction of students with a wide range of mental, physical and emotional maturity.
Provides individual and group instruction designed to meet individual needs and motivate students.
Establishes and maintains standards of student control required to achieve effective participation in all activities.
Evaluates academic and social growth of students and keeps appropriate records.
Provides appropriate instruction and activities for students to meet school/district policies, goals, and objectives.
Communicates with parents through a variety of means.
Holds parent conferences to discuss the individual student's progress and interprets the school program.
Identifies student needs and cooperates with other professional staff members in assessing and helping students solve health, attitude and learning problems.
Creates an effective environment for learning through functional and attractive displays such as bulletin boards, interest centers, etc.
Maintains professional competence through in-service education activities provided by the district and/or professional growth activities and university courses.
Participates cooperatively with the appropriate administrator to develop the method by which s/he will be evaluated in conformance with district guidelines.
Selects and requisitions instructional materials; maintains inventory records.
Cooperates in school-wide supervision of students during out-of-classroom activities.
Participates in faculty and/or district committees and the sponsorship of student activities.",Valid North Carolina license in the grade levels and areas assigned.,"ability to compare and/or judge the readily observable, functional, structural, or composite characteristics of data, people or things.
ability to speak and/or signal people to convey or exchange information.
ability to ready a variety of correspondence, reports, handbooks, forms, lists, etc.
ability to prepare correspondence, simple reports, forms, instructional materials, etc.
ability to apply principles of logical or scientific thinking to define problems, collect data, establish facts, and draw valid conclusions;
ability to record and deliver information, to explain procedures, to follow oral and written instructions.
ability to deal with people beyond giving and receiving instructions.
Ability to manage instructional time.
Ability to manage student behavior.
Ability to consult with parents, teachers and the community to enhance the learning of students."
EC Preschool Teacher,"Pre-K Teacher NATURE OF WORK Under general supervision creates an inviting, learning environment, which fosters personal growth of educationally disadvantaged children; to nurture those attitudes, skills, and knowledge necessary for future successes in school; to build string ties between home and school; to establish good relationships with parents and other staff members. DUTIES AND RESPONSIBILITIES Provides an inviting learning environment following the Creative Curriculum, Foundations, Guide to the Early Years and other state and local curriculum documents. Develops and implements daily lesson plans reflecting the needs of individual students and curriculum goals. Assesses student progress by recording daily anecdotal records and by determining expected growth as stated in the curriculum goals. Provides appropriate materials and experiences which address the social, physical, emotional, and intellectual needs of each student. Enriches the educational program by participating in local field trips and encouraging classroom visits from various school and community persons. Previews and selects appropriate instructional supplies. Provides a child-centered environment which has attractive displays, interest centers and exhibits of students' work. Plans and coordinates the work of the teacher assistant, parents, and classroom volunteers in daily activities and/or special events. Develops activities which promote strong home/school relations. Communicates regularly with parents through individual parent conferences, home visits, journals, phone calls, etc. Works closely with other community agencies (DSS, mental health, court system, churches, Smart Start) to provide extra help for students. Assists with screening process of students for possible Pre-K participation/enrollment. Participates in professional development opportunities dealing with curriculum and current early childhood issues. Maintains accurate, complete and correct records as required by law, district policy and administrative regulations. MINIMUM TRAINING BS in Birth to Kindergarten. Must be B-K licensed in North Carolina. ESSENTIAL JOB FUNCTIONS Must be physically able to operate a variety of automated office machines including computers, calculators, printers, copiers, etc. Must be able to exert up to 10 pounds of force occasionally and/or a negligible amount of force frequently or constantly to lift, carry, push, pull or otherwise move objects. Sedentary work involves sitting most of the time, but may involve walking or standing for periods of time. Requires the ability to compare and/or judge the readily observable, functional, structural, or composite characteristics of data, people or things. Requires the ability to speak and/or signal people to convey or exchange information. Requires the ability to read correspondence, invoices, purchase orders, accounting journals, travel reports, checks, etc. Requires the ability to prepare correspondence, reports, vendor payment packets, etc. using proper format. Ability to apply common sense understanding to carry out instructions furnished in written or oral form to deal with problems involving several concrete variables in or from standardized situations. KNOWLEDGE, SKILLS AND ABILITIES Ability to present material to individuals and groups of people. Ability to maintain accurate and complete records and files. Ability to type accurately at a moderate rate. Ability to use common spreadsheet, word processing and file maintenance programs. Ability to follow both oral and written instructions. Ability to work alone, focused to complete assigned duties on a daily basis and whenever other areas need immediate short-term assistance. FSLA STATUS: Exempt DISCLAIMER The preceding job description has been designed to indicate the general nature and level of work performed by employees within this classification. It is not designed to contain or be interpreted as a comprehensive inventory of all duties, responsibilities, and qualifications required of employees to this job.",,,"Provides an inviting learning environment following the Creative Curriculum, Foundations, Guide to the Early Years and other state and local curriculum documents.
Develops and implements daily lesson plans reflecting the needs of individual students and curriculum goals.
Assesses student progress by recording daily anecdotal records and by determining expected growth as stated in the curriculum goals.
Provides appropriate materials and experiences which address the social, physical, emotional, and intellectual needs of each student.
Enriches the educational program by participating in local field trips and encouraging classroom visits from various school and community persons.
Previews and selects appropriate instructional supplies.
Provides a child-centered environment which has attractive displays, interest centers and exhibits of students' work.
Plans and coordinates the work of the teacher assistant, parents, and classroom volunteers in daily activities and/or special events.
Develops activities which promote strong home/school relations.
Communicates regularly with parents through individual parent conferences, home visits, journals, phone calls, etc.
Works closely with other community agencies (DSS, mental health, court system, churches, Smart Start) to provide extra help for students.
Assists with screening process of students for possible Pre-K participation/enrollment.
Participates in professional development opportunities dealing with curriculum and current early childhood issues.
Maintains accurate, complete and correct records as required by law, district policy and administrative regulations.
BS in Birth to Kindergarten. Must be B-K licensed in North Carolina.",,"ability to compare and/or judge the readily observable, functional, structural, or composite characteristics of data, people or things.
ability to speak and/or signal people to convey or exchange information.
ability to read correspondence, invoices, purchase orders, accounting journals, travel reports, checks, etc.
ability to prepare correspondence, reports, vendor payment packets, etc.
Ability to apply common sense understanding to carry out instructions furnished in written or oral form to deal with problems involving several concrete variables in or from standardized situations.
Ability to present material to individuals and groups of people.
Ability to maintain accurate and complete records and files.
Ability to type accurately at a moderate rate.
Ability to use common spreadsheet, word processing and file maintenance programs.
Ability to follow both oral and written instructions."
Executive Assistant to the Head of School,"The assistant to the head of school is a full-time, 8:00 a.m. to 4:00 p.m. 12-month position with occasional evening commitments and weekend hours.The executive assistant to the head of school reports to the head of school and supports the head's leadership role, and performs administrative and operational tasks to maintain an effective and well-organized office.",,,"Provides direct support to the administrative leadership team and board of trustees to maintain and enhance a positive, mission-driven and student-centered school culture.
Provides oversight of the office staff.
Understands and promotes the standards and policies of the School.
Embodies and communicates the School's mission and core values, and mirrors the head's principles of good practice.
Supports the head's daily operations of the School, short and long-term goals, special events, and institutional projects.
Setting and maintaining a calm tone in a fast-paced environment.
Is accessible, approachable, and welcoming.
Fosters a partnership among employees to create a positive environment for students' academic and social-emotional learning.
Respects, affirms and protects the dignity and worth of each member of the community, and exhibits moral and ethical behavior.
Consistently maintains confidentiality and manages sensitive information with discretion, respect, and sensitivity.
Sets professional boundaries, collaborating with constituents within those boundaries.
Assists with various aspects of employee recruitment.
Takes an active part in the full life of the School.
Demonstrates a commitment to lifelong learning and consistent improvement to maintain high standards of performance.
A minimum of five years of experience in office administration (experience as an executive assistant preferred).",,"Ability to work independently as well as with a team.
Excellent administrative, organizational, and time management skills.
Excellent interpersonal, communication and proofreading skills.
experience in office administration (experience as an executive assistant preferred).
Experience with Google G Suite for Education."
Middle School Head Varsity Lacrosse Coach,"Nashoba Brooks seeks candidates for the position of head varsity lacrosse coach. The coach will work with students in Grades 7-8. Former playing and/or coaching experience is preferred. Additionally, the coach must be AED/CPR certified by the first practice. This position reports to the athletic director. Details -Spring 2025 season begins on Monday, March 24, 2025 and runs through Thursday, May 22, 2025. -Practices and games are Mondays, Wednesdays, Thursdays and Fridays (no Tuesdays) from 3:30 p.m. to 5:00 p.m. -Nashoba Brooks School has a full-sized grass playing surface, two indoor gymnasiums plus a fitness center; the facilities provide opportunities for indoor and outdoor training sessions as needed.",,,"Spring 2025 season begins on Monday, March 24, 2025 and runs through Thursday, May 22, 2025.
Practices and games are Mondays, Wednesdays, Thursdays and Fridays (no Tuesdays) from 3:30 p.m. to 5:00 p.m.
Nashoba Brooks School has a full-sized grass playing surface, two indoor gymnasiums plus a fitness center; the facilities provide opportunities for indoor and outdoor training sessions as needed.
Planning and leading practices. Arrive at practice by 3:30 and stay through dismissal at 5:00. Plan practices, delegate tasks to assistant coach(es), set up drills, and lead practices. Interact with each athlete, each practice, regardless of skill level or ability.
Coaching Games. Responsible for the equipment, medical kit and scorebook for each game. Positively interact with officials and opposing coaches. Create the game line-up, manage substitutions, and provide feedback and encouragement to players.
Attend Athletic Assembly. At the conclusion of the season, prepare and deliver remarks at the all-school assembly about the season, mentioning each player within the speech.
As an employee of Nashoba Brooks School, the head varsity lacrosse coach will model integrity, professionalism, curiosity, responsibility, creativity, and respect for all persons, as well as a demonstrated commitment to advancing the School's mission and core values of integrity, collaboration, inclusivity, empathy, and resilience.
Applicants should submit a cover letter and résumé to: Liz Conant, athletic director: coach@nashobabrooks.org",,
Columbia Superintendent,"Columbia Public Schools provides an excellent education for all students. We seek a Superintendent who serves as the chief executive officer for the operation and control of all schools, agencies and activities under the jurisdiction of the Columbia Board of Education. This individual should believe in the following compelling purpose: Every child will graduate college-, career-, and life-ready. To accomplish this, candidates for this position must believe in high-level collaboration and shared leadership, and they must have a history of leading with empathy, compassion, and a growth mindset.","for all students. We seek a Superintendent who serves as the chief executive officer for the operation and control of all schools, agencies and activities under the jurisdiction of the Columbia Board of Education. This individual should believe in the following compelling purpose: Every child will graduate college-, career-, and life-ready. To accomplish this, candidates for this position must believe in high-level collaboration and shared leadership, and they must have a history of leading with empathy, compassion, and a growth mindset.",,"REPORTING RELATIONSHIPS Reports To: The Columbia Board of Education Supervises: Chief Academics Officer, Chief Schools Officer, Chief Financial Officer, Chief Operations Officer, Chief Human Resources Officer, Chief Equity Officer, Chief Communications Officer, Safety and Security Director, Secretary to the Superintendent","//www.cpsk12.org. REPORTING RELATIONSHIPS Reports To: The Columbia Board of Education Supervises: Chief Academics Officer, Chief Schools Officer, Chief Financial Officer, Chief Operations Officer, Chief Human Resources Officer, Chief Equity Officer, Chief Communications Officer, Safety and Security Director, Secretary to the Superintendent QUALIFICATIONS Minimum: Educational Specialist Degree; possess or be eligible for a Superintendent's Certificate; a minimum of three years' successful district leadership experience. Preferred: Doctorate Degree in Education and Administration. To perform this job successfully, an individual must be able to perform each essential duty satisfactorily. The requirements listed below are representative of the knowledge, skills and abilities required. Reasonable accommodations may be made to enable individuals with disabilities to perform essential functions. ADA REQUIREMENTS","Present information to teachers, staff, other administrators, and boards. Respond to common questions and concerns. Interview students, staff, and teachers. Read, analyze, and interpret professional journals, memoranda, policies, administrative procedures, and statutes. Write business correspondence, including staff memoranda and newsletter articles. Keep information confidential when required by law, policy, or the nature of a particular situation."
Bus Driver- Special Education,"Operates school buses under all types of weather conditions, including but not limited to: fog, rain, hail, sleet, snow, and ice. Transports students and other authorized persons over regular ""to and from school"" routes, and on field, extracurricular, and special or extra activity trips as authorized by the school district officials.",,,,valid Washington state school bus driver's certificate;,
